{
  "manifest_version":"2.0.0",
  "generated_at":"2026-01-01T00:00:00+07:00",
  "batch_size":1,
  "tickers":["TEST"],
  "packages":[{"ticker":"TEST","path":"TEST_context.json","package_fingerprint":{"method":"sha256","sha256":"aaa","size_bytes":10}}],
  "source_fingerprints":[{"path":"source.csv","exists":true,"method":"sha256","sha256":"src1","size_bytes":20}],
  "stale_detection_rule":"fixture",
  "warnings":[],
  "provenance":[{"source":"fixture"}]
}
